{
  "$schema": "http://json-schema.org/draft-07/schema#",
  "$id": "https://aion.school.local/schemas/v1/rubric.schema.json",
  "title": "AION rubric v1",
  "type": "object",
  "additionalProperties": false,
  "properties": {
    "schema_version": {
      "const": "1.0.0"
    },
    "rubric_id": {
      "type": "string",
      "minLength": 1,
      "maxLength": 128,
      "pattern": "^[A-Za-z0-9][A-Za-z0-9_.:-]*$"
    },
    "rubric_version": {
      "type": "string",
      "pattern": "^(0|[1-9]\\d*)\\.(0|[1-9]\\d*)\\.(0|[1-9]\\d*)(?:-((?:0|[1-9]\\d*|\\d*[A-Za-z-][0-9A-Za-z-]*)(?:\\.(?:0|[1-9]\\d*|\\d*[A-Za-z-][0-9A-Za-z-]*))*))?(?:\\+([0-9A-Za-z-]+(?:\\.[0-9A-Za-z-]+)*))?$"
    },
    "title": {
      "type": "string",
      "minLength": 1,
      "maxLength": 10000,
      "pattern": "\\S"
    },
    "dimensions": {
      "type": "array",
      "items": {
        "type": "object",
        "additionalProperties": false,
        "properties": {
          "criterion_id": {
            "type": "string",
            "minLength": 1,
            "maxLength": 128,
            "pattern": "^[A-Za-z0-9][A-Za-z0-9_.:-]*$"
          },
          "name": {
            "type": "string",
            "minLength": 1,
            "maxLength": 10000,
            "pattern": "\\S"
          },
          "levels": {
            "type": "object",
            "additionalProperties": false,
            "properties": {
              "0": {
                "type": "string",
                "minLength": 1,
                "maxLength": 10000,
                "pattern": "\\S"
              },
              "1": {
                "type": "string",
                "minLength": 1,
                "maxLength": 10000,
                "pattern": "\\S"
              },
              "2": {
                "type": "string",
                "minLength": 1,
                "maxLength": 10000,
                "pattern": "\\S"
              },
              "3": {
                "type": "string",
                "minLength": 1,
                "maxLength": 10000,
                "pattern": "\\S"
              },
              "4": {
                "type": "string",
                "minLength": 1,
                "maxLength": 10000,
                "pattern": "\\S"
              }
            },
            "required": [
              "0",
              "1",
              "2",
              "3",
              "4"
            ]
          }
        },
        "required": [
          "criterion_id",
          "name",
          "levels"
        ]
      },
      "maxItems": 100,
      "minItems": 1
    }
  },
  "required": [
    "schema_version",
    "rubric_id",
    "rubric_version",
    "title",
    "dimensions"
  ]
}
